[
  {
    "rule_id": "fast_trigger_moon_transit_limbs_foreign",
    "name": "Moon Transit 19th-24th Nakshatra (Two Feet) — Foreign Journey Day",
    "description": "When the fast-moving Moon transits the Nakshatras representing the two feet of the Kala Purusha (19th through 24th from the birth star), it acts as an exact daily trigger for departure.",
    "source_text": {"work_name": "Phaladeepika", "chapter": "26", "verse": "36", "page": null, "quote": "The Moons's transit Distribution amongst limbs Effects... (g) 19th, 20th, 21st. 22nd. 23rd. 24th - two feet going to foreign place", "translation": null},
    "domain": "relocation",
    "event_family": "foreign_settlement",
    "event_subtype": ["travel_activation", "departure_day"],
    "rule_type": "fast_trigger",
    "status": "active",
    "priority": 88,
    "polarity": "supportive",
    "timing_band": "exact",
    "conditions": {"all_of": [], "any_of": ["Transit Moon passes through the 19th Nakshatra counted from the natal Janma Nakshatra", "Transit Moon passes through the 20th Nakshatra counted from the natal Janma Nakshatra", "Transit Moon passes through the 21st Nakshatra counted from the natal Janma Nakshatra", "Transit Moon passes through the 22nd Nakshatra counted from the natal Janma Nakshatra", "Transit Moon passes through the 23rd Nakshatra counted from the natal Janma Nakshatra", "Transit Moon passes through the 24th Nakshatra counted from the natal Janma Nakshatra"], "none_of": []},
    "signals": {"dasha": [], "transit": ["Moon"], "houses": [], "planets": [], "nakshatra": ["19th_from_Moon", "20th_from_Moon", "21st_from_Moon", "22nd_from_Moon", "23rd_from_Moon", "24th_from_Moon"], "d9": [], "sensitive_points": []},
    "interpretation": {"meaning": "When the fast-moving Moon transits the specific group of Nakshatras representing the two feet of the Kala Purusha (19th through 24th from the birth star), it acts as an exact, short-term daily trigger for departure and journeying to a foreign place.", "mode": "unknown", "quality": "unknown", "confidence": 0.85},
    "window": {"broad_window_days": 6, "exact_window_days": 1, "confidence_decay_days": 1},
    "weights": {"dasha_weight": 0.0, "transit_weight": 0.0, "fast_trigger_weight": 1.0, "classical_weight": 0.0},
    "outputs": {"symbolic_label": "moon_feet_foreign_departure", "likelihood_band": "high", "timing_band": "exact", "recommended_action": "execute_travel_departure"},
    "metadata": {"notes": "An Anga Gochara (limb transit) rule used to pinpoint the exact day a physical journey or foreign travel is activated."}
  },
  {
    "rule_id": "fast_trigger_mars_transit_limbs_foreign",
    "name": "Mars Transit 26th-27th Nakshatra (Two Eyes) — Foreign Entry Trigger",
    "description": "When Mars transits the Nakshatras representing the two eyes of the Kala Purusha (26th and 27th from birth star), its dynamic energy triggers exact travel activation or physical entry into a foreign place.",
    "source_text": {"work_name": "Phaladeepika", "chapter": "26", "verse": "37-38", "page": null, "quote": "Mars' transit Distribution amongst limbs Effects... (h) 26th, 27th - two eyes going to a foreign place", "translation": null},
    "domain": "relocation",
    "event_family": "foreign_settlement",
    "event_subtype": ["foreign_entry", "border_crossing"],
    "rule_type": "fast_trigger",
    "status": "active",
    "priority": 85,
    "polarity": "supportive",
    "timing_band": "exact",
    "conditions": {"all_of": [], "any_of": ["Transit Mars passes through the 26th Nakshatra counted from the natal Janma Nakshatra", "Transit Mars passes through the 27th Nakshatra counted from the natal Janma Nakshatra"], "none_of": []},
    "signals": {"dasha": [], "transit": ["Mars"], "houses": [], "planets": [], "nakshatra": ["26th_from_Moon", "27th_from_Moon"], "d9": [], "sensitive_points": []},
    "interpretation": {"meaning": "When Mars transits the Nakshatras representing the two eyes of the Kala Purusha (26th and 27th from the birth star), its dynamic energy triggers exact travel activation or physical entry into a foreign place.", "mode": "unknown", "quality": "unknown", "confidence": 0.85},
    "window": {"broad_window_days": 45, "exact_window_days": 14, "confidence_decay_days": 7},
    "weights": {"dasha_weight": 0.0, "transit_weight": 0.0, "fast_trigger_weight": 1.0, "classical_weight": 0.0},
    "outputs": {"symbolic_label": "mars_eyes_foreign_entry", "likelihood_band": "moderate", "timing_band": "exact", "recommended_action": "finalize_foreign_entry"},
    "metadata": {"notes": "Provides a slightly broader but still highly specific fast transit window (roughly 1.5 to 2 months) for foreign travel initiation and border crossings."}
  },
  {
    "rule_id": "fast_trigger_moon_mars_adhana_relocation",
    "name": "Moon/Mars on Adhana Tara (19th Star) — Exact Residence Shift Day",
    "description": "The exact transit of fast-moving planets (Moon or Mars) over the 19th Nakshatra (Adhana) from the birth star acts as an immediate trigger for physical geographical relocation.",
    "source_text": {"work_name": "Nakshatras as Celestial Blueprints", "chapter": null, "verse": null, "page": null, "quote": "Adhana 19th Star... Triggers geographical relocation, career settlement, and creative output.", "translation": null},
    "domain": "relocation",
    "event_family": "foreign_settlement",
    "event_subtype": ["residence_shift", "moving_day"],
    "rule_type": "fast_trigger",
    "status": "active",
    "priority": 90,
    "polarity": "supportive",
    "timing_band": "exact",
    "conditions": {"all_of": [], "any_of": ["Transit Moon passes over the exact longitude of the 19th Nakshatra (Adhana Tara) counted from the natal Janma Nakshatra", "Transit Mars passes over the exact longitude of the 19th Nakshatra (Adhana Tara) counted from the natal Janma Nakshatra"], "none_of": []},
    "signals": {"dasha": [], "transit": ["Moon", "Mars"], "houses": [], "planets": [], "nakshatra": ["19th_from_Moon"], "d9": [], "sensitive_points": ["Adhana_Tara"]},
    "interpretation": {"meaning": "The exact transit of fast-moving planets like the Moon or Mars over the 19th Nakshatra (Adhana) from the birth star acts as an immediate trigger for physical geographical relocation and establishing a new residence.", "mode": "unknown", "quality": "unknown", "confidence": 0.9},
    "window": {"broad_window_days": 3, "exact_window_days": 1, "confidence_decay_days": 1},
    "weights": {"dasha_weight": 0.0, "transit_weight": 0.0, "fast_trigger_weight": 1.0, "classical_weight": 0.0},
    "outputs": {"symbolic_label": "adhana_tara_exact_relocation", "likelihood_band": "high", "timing_band": "exact", "recommended_action": "execute_physical_move"},
    "metadata": {"notes": "A pinpoint timing technique used to identify the exact day of moving out or shifting residence belongings."}
  },
  {
    "rule_id": "fast_trigger_mars_desha_alienation",
    "name": "Mars on Desha Tara (27th Star) — Forced Departure Trigger",
    "description": "Mars transiting the exact degree of the 27th star from the Moon acts as a fast, sharp trigger for alienation from the local community and forces a sudden departure from the homeland.",
    "source_text": {"work_name": "Nakshatras as Celestial Blueprints", "chapter": null, "verse": null, "page": null, "quote": "Desha 27th Star... Determines relationship to the homeland; malefic transits can alienate the native from their community.", "translation": null},
    "domain": "relocation",
    "event_family": "foreign_settlement",
    "event_subtype": ["departure", "homeland_separation"],
    "rule_type": "fast_trigger",
    "status": "active",
    "priority": 85,
    "polarity": "challenging",
    "timing_band": "exact",
    "conditions": {"all_of": ["Transit Mars passes over the exact longitude of the 27th Nakshatra (Desha Tara) counted from the natal Janma Nakshatra"], "any_of": [], "none_of": []},
    "signals": {"dasha": [], "transit": ["Mars"], "houses": [], "planets": [], "nakshatra": ["27th_from_Moon"], "d9": [], "sensitive_points": ["Desha_Tara"]},
    "interpretation": {"meaning": "Mars transiting the exact degree of the 27th star from the Moon acts as a fast, sharp trigger for alienation from the local community and forces a sudden departure from the homeland.", "mode": "unknown", "quality": "unknown", "confidence": 0.85},
    "window": {"broad_window_days": 14, "exact_window_days": 3, "confidence_decay_days": 3},
    "weights": {"dasha_weight": 0.0, "transit_weight": 0.0, "fast_trigger_weight": 1.0, "classical_weight": 0.0},
    "outputs": {"symbolic_label": "desha_tara_forced_departure", "likelihood_band": "moderate", "timing_band": "exact", "recommended_action": "accept_departure_necessity"},
    "metadata": {"notes": "An exact transit trigger for forced moves, sudden migrations, or breaking ties with one's physical roots."}
  }
]
