[
  {
    "rule_id": "transit_adhana_nakshatra_relocation",
    "name": "Adhana Tara (19th Star) — Geographical Relocation Trigger",
    "description": "The transit of planets over the 19th Nakshatra from the birth star acts as a specialized spatial trigger for geographical relocation and establishing a new residence.",
    "source_text": {"work_name": "Nakshatras as Celestial Blueprints: An Analytical Study of Lunar Mansions in Predicting Major Life Events", "chapter": null, "verse": null, "page": null, "quote": "Adhana 19th Star... Triggers geographical relocation, career settlement, and creative output.", "translation": null},
    "domain": "relocation",
    "event_family": "foreign_settlement",
    "event_subtype": ["relocation", "permanent_settlement"],
    "rule_type": "transit",
    "status": "active",
    "priority": 88,
    "polarity": "supportive",
    "timing_band": "medium",
    "conditions": {"all_of": ["Transiting planets pass over the exact longitude of the 19th Nakshatra (Adhana Tara) counted from the natal Janma Nakshatra"], "any_of": [], "none_of": []},
    "signals": {"dasha": [], "transit": ["Any_Planet"], "houses": [], "planets": [], "nakshatra": ["19th_from_Moon"], "d9": [], "sensitive_points": ["Adhana_Tara"]},
    "interpretation": {"meaning": "The transit of planets over the 19th Nakshatra from the birth star acts as a specialized spatial trigger for geographical relocation, establishing a new residence, and settling in a new location.", "mode": "unknown", "quality": "stable", "confidence": 0.85},
    "window": {"broad_window_days": 60, "exact_window_days": 14, "confidence_decay_days": 10},
    "weights": {"dasha_weight": 0.0, "transit_weight": 0.9, "fast_trigger_weight": 0.0, "classical_weight": 0.0},
    "outputs": {"symbolic_label": "adhana_tara_relocation_trigger", "likelihood_band": "high", "timing_band": "narrow", "recommended_action": "finalize_relocation_plans"},
    "metadata": {"notes": "A longitude-sensitive transit activation technique based on the Navatara (Tara Bala) and broader Nakshatra counting systems."}
  },
  {
    "rule_id": "transit_desha_nakshatra_alienation",
    "name": "Desha Tara (27th Star) — Homeland Alienation Trigger",
    "description": "Malefic transits over the 27th star from the natal Moon disrupt the native's relationship with their homeland, leading to alienation and migration.",
    "source_text": {"work_name": "Nakshatras as Celestial Blueprints: An Analytical Study of Lunar Mansions in Predicting Major Life Events", "chapter": null, "verse": null, "page": null, "quote": "Desha 27th Star... Determines relationship to the homeland; malefic transits can alienate the native from their community.", "translation": null},
    "domain": "relocation",
    "event_family": "foreign_settlement",
    "event_subtype": ["migration", "homeland_separation"],
    "rule_type": "transit",
    "status": "active",
    "priority": 85,
    "polarity": "challenging",
    "timing_band": "medium",
    "conditions": {"all_of": ["Transiting malefic planets pass over the exact longitude of the 27th Nakshatra (Desha Tara) counted from the natal Janma Nakshatra"], "any_of": [], "none_of": []},
    "signals": {"dasha": [], "transit": ["Malefics"], "houses": [], "planets": [], "nakshatra": ["27th_from_Moon"], "d9": [], "sensitive_points": ["Desha_Tara"]},
    "interpretation": {"meaning": "Malefic transits (such as Saturn, Rahu, or Ketu) over the 27th star from the natal Moon disrupt the native's relationship with their homeland, leading to alienation from their local community and separation from their roots via migration.", "mode": "unknown", "quality": "painful", "confidence": 0.85},
    "window": {"broad_window_days": 90, "exact_window_days": 21, "confidence_decay_days": 14},
    "weights": {"dasha_weight": 0.0, "transit_weight": 0.9, "fast_trigger_weight": 0.0, "classical_weight": 0.0},
    "outputs": {"symbolic_label": "desha_tara_alienation_trigger", "likelihood_band": "moderate", "timing_band": "narrow", "recommended_action": "process_homeland_detachment"},
    "metadata": {"notes": "Specifies a challenging trigger for leaving one's homeland, often under difficult or alienating circumstances."}
  },
  {
    "rule_id": "transit_saturn_rahu_ketu_limbs_travel",
    "name": "Saturn/Rahu/Ketu Transit 6th-8th Nakshatra (Right Leg) — Physical Travel",
    "description": "When slow-moving karmic planets transit the 6th-8th Nakshatras from the birth star (symbolizing the right leg), it activates a physical window for travel and movement.",
    "source_text": {"work_name": "Phaladeepika", "chapter": "26", "verse": "39-40", "page": null, "quote": "The transits of Saturn, Raha and Ketu - Distribution amongst Limbs Effects ... (c) 6th, 7th, 8th - right leg travel", "translation": null},
    "domain": "relocation",
    "event_family": "foreign_settlement",
    "event_subtype": ["foreign_travel", "temporary_move"],
    "rule_type": "transit",
    "status": "active",
    "priority": 82,
    "polarity": "mixed",
    "timing_band": "medium",
    "conditions": {"all_of": [], "any_of": ["Transit Saturn passes through the 6th, 7th, or 8th Nakshatra counted from the natal Janma Nakshatra", "Transit Rahu passes through the 6th, 7th, or 8th Nakshatra counted from the natal Janma Nakshatra", "Transit Ketu passes through the 6th, 7th, or 8th Nakshatra counted from the natal Janma Nakshatra"], "none_of": []},
    "signals": {"dasha": [], "transit": ["Saturn", "Rahu", "Ketu"], "houses": [], "planets": [], "nakshatra": ["6th_from_Moon", "7th_from_Moon", "8th_from_Moon"], "d9": [], "sensitive_points": []},
    "interpretation": {"meaning": "When slow-moving karmic planets (Saturn, Rahu, or Ketu) transit the 6th, 7th, or 8th Nakshatras from the birth star—which symbolize the right leg of the Kala Purusha—it activates a physical window for travel and movement away from the current residence.", "mode": "unknown", "quality": "unknown", "confidence": 0.8},
    "window": {"broad_window_days": 180, "exact_window_days": 45, "confidence_decay_days": 30},
    "weights": {"dasha_weight": 0.0, "transit_weight": 0.85, "fast_trigger_weight": 0.0, "classical_weight": 0.0},
    "outputs": {"symbolic_label": "limbs_travel_transit_active", "likelihood_band": "moderate", "timing_band": "narrow", "recommended_action": "execute_travel_plans"},
    "metadata": {"notes": "A classic limb-based Nakshatra transit rule (Anga Gochara) pinpointing extended periods of travel triggered by slow-moving outer planets."}
  }
]
